{
  "schema_version": 3,
  "project": {
    "name": "skills"
  },
  "tasks": [
    {
      "id": "SK-AS1-SEMANTICS",
      "parent_id": "SK-AS1-0000",
      "kind": "task",
      "title": "Extend canonical semantic and mutation contracts",
      "objective": "Supply durable project declarations/skill usage/orientation and typed amendments through the existing Todo authority.",
      "priority": 100,
      "parallel_policy": "serial",
      "scope": {
        "exclusive_paths": [
          "todo-orchestrator",
          "integrations/coding-workflow-mcp",
          "planning/adaptive-surface-v1",
          "tests/as1"
        ],
        "read_paths": [
          "planning/adaptive-surface-v1"
        ]
      },
      "depends_on": [],
      "gates": [
        {
          "id": "SK-AS1-SEMANTICS-ACCEPT",
          "type": "command",
          "required": true,
          "argv": [
            "/home/tumlinson/project-control/.venv/bin/python",
            "planning/adaptive-surface-v1/scripts/acceptance_gate.py",
            "--outcome",
            "SK-AS1-SEMANTICS"
          ],
          "cwd": ".",
          "timeout": 1200,
          "input_paths": [
            "todo-orchestrator",
            "integrations/coding-workflow-mcp",
            "tests/as1",
            "planning/adaptive-surface-v1/contracts",
            "planning/adaptive-surface-v1/scripts/acceptance_gate.py"
          ],
          "track_git_head": false
        }
      ],
      "result_policy": {
        "allowed_dispositions": [
          "validated",
          "no_change_required"
        ]
      },
      "next_action": "Read SK-AS1-SEMANTICS in planning/adaptive-surface-v1/planning/outcomes.json. Verify producer receipts and pass every required case."
    },
    {
      "id": "SK-AS1-RUNTIME",
      "parent_id": "SK-AS1-0000",
      "kind": "task",
      "title": "Adapt the existing local service for read-only scout modes",
      "objective": "Reuse the model supervisor in investigator/skill modes without tying persistent jobs to GPU or child coding authority.",
      "priority": 100,
      "parallel_policy": "serial",
      "scope": {
        "exclusive_paths": [
          "local-coding-worker",
          "integrations/coding-workflow-mcp",
          "planning/adaptive-surface-v1",
          "tests/as1"
        ],
        "read_paths": [
          "planning/adaptive-surface-v1"
        ]
      },
      "depends_on": [
        {
          "type": "task",
          "task_id": "SK-AS1-SEMANTICS"
        }
      ],
      "gates": [
        {
          "id": "SK-AS1-RUNTIME-ACCEPT",
          "type": "command",
          "required": true,
          "argv": [
            "/home/tumlinson/project-control/.venv/bin/python",
            "planning/adaptive-surface-v1/scripts/acceptance_gate.py",
            "--outcome",
            "SK-AS1-RUNTIME"
          ],
          "cwd": ".",
          "timeout": 1200,
          "input_paths": [
            "local-coding-worker",
            "integrations/coding-workflow-mcp",
            "tests/as1",
            "planning/adaptive-surface-v1/contracts",
            "planning/adaptive-surface-v1/scripts/acceptance_gate.py"
          ],
          "track_git_head": false
        }
      ],
      "result_policy": {
        "allowed_dispositions": [
          "validated",
          "no_change_required"
        ]
      },
      "next_action": "Read SK-AS1-RUNTIME in planning/adaptive-surface-v1/planning/outcomes.json. Verify producer receipts and pass every required case."
    },
    {
      "id": "SK-AS1-GPU",
      "parent_id": "SK-AS1-0000",
      "kind": "task",
      "title": "Make warm observer models reclaimable by foreground work",
      "objective": "Complete observer/skill residency participation in the existing host-global CUDA eviction/interlock protocol.",
      "priority": 100,
      "parallel_policy": "serial",
      "scope": {
        "exclusive_paths": [
          "cuda/scripts",
          "cuda/tests",
          "local-coding-worker",
          "planning/adaptive-surface-v1",
          "tests/as1",
          "todo-orchestrator/todo_orchestrator/background/host.py",
          "todo-orchestrator/todo_orchestrator/runtime/facade.py"
        ],
        "read_paths": [
          "planning/adaptive-surface-v1"
        ]
      },
      "depends_on": [
        {
          "type": "task",
          "task_id": "SK-AS1-RUNTIME"
        }
      ],
      "gates": [
        {
          "id": "SK-AS1-GPU-ACCEPT",
          "type": "command",
          "required": true,
          "argv": [
            "/home/tumlinson/project-control/.venv/bin/python",
            "planning/adaptive-surface-v1/scripts/acceptance_gate.py",
            "--outcome",
            "SK-AS1-GPU"
          ],
          "cwd": ".",
          "timeout": 1200,
          "input_paths": [
            "cuda/scripts",
            "cuda/tests",
            "local-coding-worker",
            "tests/as1",
            "planning/adaptive-surface-v1/contracts",
            "planning/adaptive-surface-v1/scripts/acceptance_gate.py",
            "todo-orchestrator/todo_orchestrator/background/host.py",
            "todo-orchestrator/todo_orchestrator/runtime/facade.py"
          ],
          "track_git_head": false
        }
      ],
      "result_policy": {
        "allowed_dispositions": [
          "validated",
          "no_change_required"
        ]
      },
      "next_action": "Read SK-AS1-GPU in planning/adaptive-surface-v1/planning/outcomes.json. Verify producer receipts and pass every required case."
    },
    {
      "id": "SK-AS1-ROUTING",
      "parent_id": "SK-AS1-0000",
      "kind": "task",
      "title": "Make native skills role-efficient and preserve corpus routing",
      "objective": "Update instruction routing for native agents and the observer adapter without rewriting technical skill content.",
      "priority": 100,
      "parallel_policy": "serial",
      "scope": {
        "exclusive_paths": [
          "cuda",
          "local-coding-worker",
          "todo-orchestrator",
          "cpp-context-compiler",
          "integrations",
          "planning/adaptive-surface-v1",
          "tests/as1"
        ],
        "read_paths": [
          "planning/adaptive-surface-v1"
        ]
      },
      "depends_on": [
        {
          "type": "task",
          "task_id": "SK-AS1-SEMANTICS"
        },
        {
          "type": "task",
          "task_id": "SK-AS1-GPU"
        }
      ],
      "gates": [
        {
          "id": "SK-AS1-ROUTING-ACCEPT",
          "type": "command",
          "required": true,
          "argv": [
            "/home/tumlinson/project-control/.venv/bin/python",
            "planning/adaptive-surface-v1/scripts/acceptance_gate.py",
            "--outcome",
            "SK-AS1-ROUTING"
          ],
          "cwd": ".",
          "timeout": 1200,
          "input_paths": [
            "cuda",
            "local-coding-worker",
            "todo-orchestrator",
            "cpp-context-compiler",
            "integrations",
            "tests/as1",
            "planning/adaptive-surface-v1/contracts",
            "planning/adaptive-surface-v1/scripts/acceptance_gate.py"
          ],
          "track_git_head": false
        }
      ],
      "result_policy": {
        "allowed_dispositions": [
          "validated",
          "no_change_required"
        ]
      },
      "next_action": "Read SK-AS1-ROUTING in planning/adaptive-surface-v1/planning/outcomes.json. Verify producer receipts and pass every required case."
    },
    {
      "id": "SK-AS1-QUALIFY",
      "parent_id": "SK-AS1-0000",
      "kind": "task",
      "title": "Qualify kernel, worker, CUDA and native-skill interoperation",
      "objective": "Produce a paired Skills qualification receipt usable by Project Control without merging authorities.",
      "priority": 100,
      "parallel_policy": "serial",
      "scope": {
        "exclusive_paths": [
          "tests",
          "todo-orchestrator/tests",
          "cuda/tests",
          "local-coding-worker/tests",
          "integrations",
          "planning/adaptive-surface-v1"
        ],
        "read_paths": [
          "planning/adaptive-surface-v1"
        ]
      },
      "depends_on": [
        {
          "type": "task",
          "task_id": "SK-AS1-ROUTING"
        }
      ],
      "gates": [
        {
          "id": "SK-AS1-QUALIFY-ACCEPT",
          "type": "command",
          "required": true,
          "argv": [
            "/home/tumlinson/project-control/.venv/bin/python",
            "planning/adaptive-surface-v1/scripts/acceptance_gate.py",
            "--outcome",
            "SK-AS1-QUALIFY"
          ],
          "cwd": ".",
          "timeout": 1200,
          "input_paths": [
            "tests",
            "todo-orchestrator/tests",
            "cuda/tests",
            "local-coding-worker/tests",
            "integrations",
            "tests/as1",
            "planning/adaptive-surface-v1/contracts",
            "planning/adaptive-surface-v1/scripts/acceptance_gate.py"
          ],
          "track_git_head": false
        }
      ],
      "result_policy": {
        "allowed_dispositions": [
          "validated",
          "no_change_required"
        ]
      },
      "next_action": "Read SK-AS1-QUALIFY in planning/adaptive-surface-v1/planning/outcomes.json. Verify producer receipts and pass every required case."
    },
    {
      "id": "SK-AS1-RELEASE",
      "parent_id": "SK-AS1-0000",
      "kind": "task",
      "title": "Pin the qualified standalone release in Skills",
      "objective": "Finish paired packaging by pinning the qualified standalone Project Control commit and publishing a bound release receipt.",
      "priority": 100,
      "parallel_policy": "serial",
      "scope": {
        "exclusive_paths": [
          "project-control",
          ".gitmodules",
          "integrations",
          "planning/adaptive-surface-v1",